{
  "schema_version": "2.6.13",
  "ledger_id": "v2.6.13-holding-event-completion-20260814T073717Z",
  "base_bundle_id": "event-risk-2026-08-13-cutoff-20260814T012435982Z",
  "base_bundle_file_hash": "87a921f10d80649b34462e92acd8d8e2209d74e6a4a32233e82256747207cce8",
  "successor_bundle_id": "event-risk-2026-08-13-holding-completion-20260814T073717Z",
  "market_session": "2026-08-13",
  "analysis_cutoff": "2026-08-14T07:37:17Z",
  "checked_at": "2026-08-14T07:37:17Z",
  "change_classification": "DATA_ONLY",
  "evidence_routes": [
    {
      "evidence_id": "NBIS-IR-FINANCIALS-Q2-2026",
      "ticker": "NBIS",
      "source_url": "https://nebius.com/financials",
      "source_type": "ISSUER_IR",
      "checked_at": "2026-08-14T07:37:17Z",
      "route_result": "EVENT_VERIFIED",
      "verification_status": "VERIFIED"
    },
    {
      "evidence_id": "NBIS-IR-EVENTS-NEXT-EARNINGS",
      "ticker": "NBIS",
      "source_url": "https://nebius.com/investor-events",
      "source_type": "ISSUER_IR",
      "checked_at": "2026-08-14T07:37:17Z",
      "route_result": "ROUTE_CHECKED_NO_ANNOUNCEMENT",
      "verification_status": "VERIFIED"
    },
    {
      "evidence_id": "NBIS-SEC-PREFUNDED-WARRANT-20260311",
      "ticker": "NBIS",
      "source_url": "https://www.sec.gov/Archives/edgar/data/1513845/000110465926026163/0001104659-26-026163.txt",
      "source_type": "SEC",
      "checked_at": "2026-08-14T07:37:17Z",
      "route_result": "EVENT_VERIFIED",
      "verification_status": "VERIFIED"
    },
    {
      "evidence_id": "NBIS-SEC-CONVERTIBLE-NOTES-20260318",
      "ticker": "NBIS",
      "source_url": "https://www.sec.gov/Archives/edgar/data/1513845/000110465926029863/0001104659-26-029863.txt",
      "source_type": "SEC",
      "checked_at": "2026-08-14T07:37:17Z",
      "route_result": "EVENT_VERIFIED",
      "verification_status": "VERIFIED"
    },
    {
      "evidence_id": "NBIS-SEC-META-CONTRACT-20260316",
      "ticker": "NBIS",
      "source_url": "https://www.sec.gov/Archives/edgar/data/1513845/000110465926027886/0001104659-26-027886.txt",
      "source_type": "SEC",
      "checked_at": "2026-08-14T07:37:17Z",
      "route_result": "EVENT_VERIFIED",
      "verification_status": "VERIFIED"
    },
    {
      "evidence_id": "NBIS-SEC-SECURED-FACILITY-20260717",
      "ticker": "NBIS",
      "source_url": "https://www.sec.gov/Archives/edgar/data/1513845/000110465926084452/0001104659-26-084452.txt",
      "source_type": "SEC",
      "checked_at": "2026-08-14T07:37:17Z",
      "route_result": "EVENT_VERIFIED",
      "verification_status": "VERIFIED"
    },
    {
      "evidence_id": "NBIS-SEC-CURRENT-FILINGS-REGULATORY",
      "ticker": "NBIS",
      "source_url": "https://www.sec.gov/edgar/browse/?CIK=1513845&owner=exclude&action=getcompany",
      "source_type": "SEC",
      "checked_at": "2026-08-14T07:37:17Z",
      "route_result": "ROUTE_CHECKED_NO_ANNOUNCEMENT",
      "verification_status": "VERIFIED"
    },
    {
      "evidence_id": "NBIS-NASDAQ-CURRENT-TRADE-HALTS",
      "ticker": "NBIS",
      "source_url": "https://www.nasdaqtrader.com/rss.aspx?feed=tradehalts",
      "source_type": "EXCHANGE",
      "checked_at": "2026-08-14T07:37:17Z",
      "route_result": "ROUTE_CHECKED_NO_ANNOUNCEMENT",
      "verification_status": "VERIFIED"
    },
    {
      "evidence_id": "MVLL-SPONSOR-PRODUCT-CURRENT",
      "ticker": "MVLL",
      "source_url": "https://graniteshares.com/etfs/mvll/",
      "source_type": "ETF_SPONSOR",
      "checked_at": "2026-08-14T07:37:17Z",
      "route_result": "CURRENT_STRUCTURE_VERIFIED",
      "verification_status": "VERIFIED"
    },
    {
      "evidence_id": "MVLL-SPONSOR-PRESS-SPLIT",
      "ticker": "MVLL",
      "source_url": "https://graniteshares.com/press/graniteshares-announces-forward-splits/",
      "source_type": "ETF_SPONSOR",
      "checked_at": "2026-08-14T07:37:17Z",
      "route_result": "EVENT_VERIFIED",
      "verification_status": "VERIFIED"
    },
    {
      "evidence_id": "MVLL-SPONSOR-SPLIT-SUPPLEMENT",
      "ticker": "MVLL",
      "source_url": "https://graniteshares.com/media/t5cbormv/grsh-etf-trust-20260612-fwd-split-supplement.pdf",
      "source_type": "ETF_SPONSOR",
      "checked_at": "2026-08-14T07:37:17Z",
      "route_result": "EVENT_VERIFIED",
      "verification_status": "VERIFIED"
    },
    {
      "evidence_id": "MVLL-SPONSOR-PRESS-NO-LIQUIDATION",
      "ticker": "MVLL",
      "source_url": "https://graniteshares.com/press/",
      "source_type": "ETF_SPONSOR",
      "checked_at": "2026-08-14T07:37:17Z",
      "route_result": "ROUTE_CHECKED_NO_ANNOUNCEMENT",
      "verification_status": "VERIFIED"
    },
    {
      "evidence_id": "MVLL-SEC-CURRENT-PRODUCT-FILINGS",
      "ticker": "MVLL",
      "source_url": "https://www.sec.gov/cgi-bin/browse-edgar?CIK=0001689873&owner=exclude&action=getcompany&count=100",
      "source_type": "SEC",
      "checked_at": "2026-08-14T07:37:17Z",
      "route_result": "ROUTE_CHECKED_NO_ANNOUNCEMENT",
      "verification_status": "VERIFIED"
    },
    {
      "evidence_id": "MRVL-IR-Q1FY27-RESULTS",
      "ticker": "MRVL",
      "source_url": "https://investor.marvell.com/news-events/press-releases/detail/1023/marvell-technology-inc-reports-first-quarter-of-fiscal-year-2027-financial-results",
      "source_type": "ISSUER_IR",
      "checked_at": "2026-08-14T07:37:17Z",
      "route_result": "EVENT_VERIFIED",
      "verification_status": "VERIFIED"
    },
    {
      "evidence_id": "MRVL-IR-Q2FY27-SCHEDULE",
      "ticker": "MRVL",
      "source_url": "https://investor.marvell.com/news-events/press-releases/detail/1029/marvell-technology-inc-announces-conference-call-to-review-second-quarter-of-fiscal-year-2027-financial-results-announces-investor-day-on-october-6-2026",
      "source_type": "ISSUER_IR",
      "checked_at": "2026-08-14T07:37:17Z",
      "route_result": "EVENT_VERIFIED",
      "verification_status": "VERIFIED"
    },
    {
      "evidence_id": "MRVL-SEC-Q1FY27-10Q",
      "ticker": "MRVL",
      "source_url": "https://www.sec.gov/Archives/edgar/data/1835632/000183563226000019/mrvl-20260502.htm",
      "source_type": "SEC",
      "checked_at": "2026-08-14T07:37:17Z",
      "route_result": "EVENT_VERIFIED",
      "verification_status": "VERIFIED"
    },
    {
      "evidence_id": "MRVL-SEC-FY2026-10K",
      "ticker": "MRVL",
      "source_url": "https://www.sec.gov/Archives/edgar/data/1835632/000183563226000011/mrvl-20260131.htm",
      "source_type": "SEC",
      "checked_at": "2026-08-14T07:37:17Z",
      "route_result": "EVENT_VERIFIED",
      "verification_status": "VERIFIED"
    },
    {
      "evidence_id": "SOXL-SPONSOR-PRODUCT-CURRENT",
      "ticker": "SOXL",
      "source_url": "https://www.direxion.com/product/daily-semiconductor-bull-bear-3x-etfs",
      "source_type": "ETF_SPONSOR",
      "checked_at": "2026-08-14T07:37:17Z",
      "route_result": "ROUTE_CHECKED_NO_ANNOUNCEMENT",
      "verification_status": "VERIFIED"
    },
    {
      "evidence_id": "SOXL-SPONSOR-PRESS-CURRENT",
      "ticker": "SOXL",
      "source_url": "https://www.direxion.com/product/daily-semiconductor-bull-bear-3x-etfs",
      "source_type": "ETF_SPONSOR",
      "checked_at": "2026-08-14T07:37:17Z",
      "route_result": "ROUTE_CHECKED_NO_ANNOUNCEMENT",
      "verification_status": "VERIFIED"
    },
    {
      "evidence_id": "SOXL-SEC-CURRENT-PRODUCT-FILINGS",
      "ticker": "SOXL",
      "source_url": "https://www.sec.gov/Archives/edgar/data/1424958/000119312526078540/d50601d497k.htm",
      "source_type": "SEC",
      "checked_at": "2026-08-14T07:37:17Z",
      "route_result": "ROUTE_CHECKED_NO_ANNOUNCEMENT",
      "verification_status": "VERIFIED"
    }
  ],
  "required_category_checks": [
    {
      "category_id": "NBIS:LATEST_EARNINGS",
      "ticker": "NBIS",
      "required_category": "LATEST_EARNINGS",
      "bundle_event_category": "RECENT_EARNINGS",
      "required_source_route_ids": ["NBIS-IR-FINANCIALS-Q2-2026"],
      "checked_source_route_ids": ["NBIS-IR-FINANCIALS-Q2-2026"],
      "coverage_status": "COMPLETE_FOR_REQUIRED_CATEGORIES",
      "event_effect": "EVENT_REVIEW_REQUIRED",
      "announcement_status": "ANNOUNCED",
      "published_at": "2026-08-12T11:58:03Z",
      "effective_at": "2026-08-12T11:58:03Z",
      "materiality": "HIGH",
      "next_refresh_trigger": "AT_NEXT_OFFICIAL_RESULTS_OR_MATERIAL_FILING",
      "point_in_time_eligible": true,
      "claim_ids": ["NBIS-Q2-2026-RESULTS-RELEASED"],
      "evidence_ids": ["NBIS-IR-FINANCIALS-Q2-2026"],
      "order_authority": false
    },
    {
      "category_id": "NBIS:NEXT_OFFICIALLY_ANNOUNCED_EARNINGS",
      "ticker": "NBIS",
      "required_category": "NEXT_OFFICIALLY_ANNOUNCED_EARNINGS",
      "bundle_event_category": "NEXT_EARNINGS",
      "required_source_route_ids": ["NBIS-IR-EVENTS-NEXT-EARNINGS"],
      "checked_source_route_ids": ["NBIS-IR-EVENTS-NEXT-EARNINGS"],
      "coverage_status": "COMPLETE_FOR_REQUIRED_CATEGORIES",
      "event_effect": "CONTEXT_ONLY",
      "announcement_status": "NOT_YET_ANNOUNCED_AS_OF_CUTOFF",
      "published_at": null,
      "effective_at": null,
      "materiality": "UNKNOWN",
      "next_refresh_trigger": "AT_NEW_OFFICIAL_IR_EVENT_POSTING",
      "point_in_time_eligible": true,
      "claim_ids": [],
      "evidence_ids": ["NBIS-IR-EVENTS-NEXT-EARNINGS"],
      "order_authority": false
    },
    {
      "category_id": "NBIS:FINANCING",
      "ticker": "NBIS",
      "required_category": "FINANCING",
      "bundle_event_category": "FINANCING_DILUTION",
      "required_source_route_ids": ["NBIS-SEC-SECURED-FACILITY-20260717", "NBIS-SEC-CONVERTIBLE-NOTES-20260318"],
      "checked_source_route_ids": ["NBIS-SEC-SECURED-FACILITY-20260717", "NBIS-SEC-CONVERTIBLE-NOTES-20260318"],
      "coverage_status": "COMPLETE_FOR_REQUIRED_CATEGORIES",
      "event_effect": "EVENT_REVIEW_REQUIRED",
      "announcement_status": "ANNOUNCED",
      "published_at": "2026-07-17T13:29:13Z",